"data.general.name","data.general.locale.name","data.general.locale.timezone","data.general.address.street","data.general.address.comment","data.general.address.fullAddress","data.general.address.mapPosition","data.general.description","data.general.contacts.website","data.general.contacts.email","data.general.contacts.phones","data.general.image","data.general.gallery","data.general.category.type","data.general.category.name","data.general.organization.name","data.general.organization.locale.name","data.general.organization.locale.timezone","data.general.organization.address.street","data.general.organization.address.comment","data.general.organization.address.fullAddress","data.general.organization.address.mapPosition","data.general.organization.inn","data.general.organization.type","data.general.organization.subordination.name","data.general.organization.subordination.timezone","data.general.organization.socialGroups","data.general.organization.id","data.general.tags","data.general.videoHostings","data.general.workingSchedule.0","data.general.workingSchedule.1","data.general.workingSchedule.2","data.general.workingSchedule.3","data.general.workingSchedule.4","data.general.workingSchedule.5","data.general.workingSchedule.6","data.general.extraFields.artType","data.general.extraFields.audienceType","data.general.extraFields.language","data.general.extraFields.professionalLevel","data.general.extraFields.virtualTour","data.general.extraFields.types","data.general.seances","data.general.id","data.general.externalInfo","data.general.externalIds.eipskId","data.general.externalIds.culturarf","data.general.externalIds.goscatalogId","data.general.externalIds.statistic","data.info.createDate","data.info.updateDate","geom"
Вашкинский районный краеведческий музей,Вашкинский район,Europe/Moscow,"ул Первомайская,д 20",,"обл Вологодская,р-н Вашкинский,с Липин Бор,ул Первомайская,д 20","{""type"":""Point""}","<p>Вашкинский районный краеведческий музей является информационным и культурным центром для всех жителей округа. Предшественником музея был Центр традиционной народной культуры, который был открыт 4 марта 1994 года. В 2006 году центр преобразован в Вашкинский районный краеведческий музей. </p><p> В музее насчитывается более 9 000 экспонатов, которые хранят память и традиции края. Основной фонд музея распределен на коллекции: археология, металл, дерево, керамика, текстиль, нумизматика, письменные памятники, изобразительные источники. В музее представлены постоянно действующие экспозиции «Археология», «Кузнечный промысел», «Берестяной промысел», «Гончарный промысел», «Русская изба», «Спутник женской судьбы», «Народный костюм», «Великая Отечественная война», «Предметы крестьянского быта», «Дом ремесел», «Рыба и рыболовство на Белом озере», а также временные выставки.</p>",,lipinbormuseum@rambler.ru,"[{""value"":""78175821437"",""comment"":""""}]","{""url"":""https://all.culture.ru/uploads/d09707c87e9db4c479ccca185ef9a1f4.jpg"",""title"":""Изображение 030.jpg""}",,,Музеи и галереи,БУК «Вашкинский районный краеведческий музей»,Вашкинский район,Europe/Moscow,"ул Первомайская,д 20",,"обл Вологодская,р-н Вашкинский,с Липин Бор,ул Первомайская,д 20",,3504025916,mincult,Вашкинский район,Europe/Moscow,,4753,"[{""name"":""История""},{""name"":""Краеведение""},{""name"":""Доступная среда""}]",,"{""from"":""09:00:00"",""to"":""17:00:00""}","{""from"":""09:00:00"",""to"":""17:00:00""}","{""from"":""09:00:00"",""to"":""17:00:00""}","{""from"":""09:00:00"",""to"":""17:00:00""}","{""from"":""09:00:00"",""to"":""17:00:00""}",,,,,,,,"[""Краеведческий""]",,15027,"[{""url"":""https://www.culture.ru/institutes/20951/vashkinskii-raionnyi-kraevedcheskii-muzei"",""serviceName"":""Культура.рф""},{""url"":""https://afisha7.ru/lipin-bor/muzei-i-galerei/7177pl"",""serviceName"":""Афиша7""},{""url"":""https://map.funtam.ru/offer/poi?showMainEvent=false&shareId=b9e52cd0-e03c-4abc-9600-7a122fa768f8&shareType=venue"",""serviceName"":""ФанТам""}]",15027,,1776,141904,"2015-09-14T11:18:44Z","2025-09-17T13:13:05Z",
Сямженский районный краеведческий музей,Сямженский район,Europe/Moscow,"ул Советская,д 24",,"обл Вологодская,р-н Сямженский,с Сямжа,ул Советская,д 24","{""type"":""Point""}","<p>Сямженский районный краеведческий музей – один из музеев с. Сямжа Сямженского района. Он был создан 4 июня 1991 года. Учредителем является Сямженский муниципальный район. </p><p>В краеведческом музее представлены экспозиции: «Природа», «Солдат и труженик спасли страну», «Археология», «Культура и быт (конец XIX – начало XX в.)». </p><p>Сегодня в собрании музея зарегистрировано более пяти тысяч единиц хранения, есть интересные коллекции прялок, самоваров, берестяных изделий, традиционных народных костюмов и городской одежды конца XIХ века, русской вышивки. Собрано много документов времен Великой Отечественной войны, о событиях становления советской власти в крае, о периоде развития Сямженского района в 70–80 гг. </p><p>Основные направления деятельности музея: научно-исследовательская, научно-фондовая, экспозиционно-выставочная, культурно-просветительская.</p><p>Всегда в продаже сувенирная продукция с символикой района и красивыми местами Сямжи.</p>",https://rkm-syamzha.vlg.muzkult.ru,museum-skm@mail.ru,"[{""value"":""78175221858"",""comment"":""""},{""value"":""78175221032""}]","{""url"":""https://all.culture.ru/uploads/f162023b422bcd397d7b0c0318cfe0c2.jpeg"",""title"":""aAJn5Nh_4XE.jpg""}",,,Музеи и галереи,БУК Сямженского МО «Сямженский краеведческий музей»,Сямженский район,Europe/Moscow,"ул Советская,д 24",,"обл Вологодская,р-н Сямженский,с Сямжа,ул Советская,д 24",,3516003297,mincult,Сямженский район,Europe/Moscow,"[{""network"":""ok"",""name"":""Комсомол в моей судьбе! ВЛКСМ - 100 лет!"",""networkId"":""55137242317042"",""updateDate"":""2021-10-12T07:03:25Z"",""createDate"":""2021-10-12T07:03:25Z"",""accountId"":36616,""postingGroupId"":35686},{""network"":""ok"",""name"":""Музей Краеведческий"",""networkId"":""561119970034"",""isPersonal"":true,""updateDate"":""2021-04-08T11:46:09Z"",""createDate"":""2021-04-08T11:46:09Z"",""accountId"":36616,""postingGroupId"":33464}]",4779,"[{""name"":""Доступная среда""}]",,"{""from"":""09:00:00"",""to"":""17:00:00""}","{""from"":""09:00:00"",""to"":""17:00:00""}","{""from"":""09:00:00"",""to"":""17:00:00""}","{""from"":""09:00:00"",""to"":""17:00:00""}","{""from"":""09:00:00"",""to"":""17:00:00""}",,,,,,,,"[""Краеведческий""]",,15082,"[{""url"":""https://www.culture.ru/institutes/20920/syamzhenskii-raionnyi-kraevedcheskii-muzei"",""serviceName"":""Культура.рф""},{""url"":""https://afisha7.ru/syamzha/muzei-i-galerei/7207pl"",""serviceName"":""Афиша7""},{""url"":""https://map.funtam.ru/offer/poi?showMainEvent=false&shareId=f3162933-1b7b-4112-8480-5d5d7e65c8bc&shareType=venue"",""serviceName"":""ФанТам""}]",15082,,1757,139016,"2015-09-15T11:41:42Z","2025-05-21T07:11:11Z",
Чагодощенский музей истории и народной культуры,Чагодощенский район,Europe/Moscow,"ул Кирова,д 1",,"обл Вологодская,р-н Чагодощенский,рп Чагода,ул Кирова,д 1","{""type"":""Point""}","<p><span>Чагодощенский музей истории и народной культуры – один из самых молодых музеев Вологодской области. Он располагается в центре рабочего поселка Чагода, построенного в 1920–1930-х годах XX века по чертежам известного советского архитектора Н. А. Троцкого. В годы Великой Отечественной войны здесь располагался эвакогоспиталь 2715 Волховского фронта.</span></p><p><span>Чагодощенский музей предлагает посетителям 7 постоянных экспозиций, рассказывающих об истории здешних мест: «Древняя и средневековая история края», «Предметы быта», «Орудия труда к. XIX – н. XX в.», «Природа родного края», «Промышленность и сельское хозяйство», «Народное образование и культура», «Защитники Отечества». </span></p><p><span>Параллельно с постоянными экспозициями работает выставочный зал. Здесь проходят выставки исторического, культурно-этнографического и художественного характера. Фонды музея состоят из 13 коллекций. Приоритетными являются: «Стекло», «Археология», «Живопись», «Нумизматика», «Документы». С момента образования сотрудники музея занимаются сбором и изучением изделий из стекла. Ведется научно-исследовательская работа по созданию истории стекольного производства в чагодощенском крае с XIX века по настоящее время. Ежегодным итогом этой работы становятся выставки стекла, проводимые в рамках празднования Дня стеклоделов.</span></p>",http://chagodamuzei.ru/index,,"[{""value"":""78174121658"",""comment"":""""}]","{""url"":""https://all.culture.ru/uploads/00ac5de529e7c5369d88ef3f8d7a1ad5.jpeg"",""title"":""dcdd06490ec5681ec3f14a5d35a08213.jpeg""}",,,Музеи и галереи,Чагодощенский музей истории и народной культуры,Чагодощенский район,Europe/Moscow,"ул Школьная,д 15",,"обл Вологодская,р-н Чагодощенский,п Чагода,ул Школьная,д 15",,3522000583,mincult,Чагодощенский район,Europe/Moscow,,10102,"[{""name"":""Доступная среда""}]",,"{""from"":""08:00:00"",""to"":""17:00:00""}","{""from"":""08:00:00"",""to"":""17:00:00""}","{""from"":""08:00:00"",""to"":""17:00:00""}","{""from"":""08:00:00"",""to"":""17:00:00""}","{""from"":""08:00:00"",""to"":""17:00:00""}",,,,,,,,"[""Краеведческий""]",,15163,"[{""url"":""https://afisha7.ru/chagoda/muzei-i-galerei/7240pl"",""serviceName"":""Афиша7""},{""url"":""https://www.culture.ru/institutes/8276/chagodoshenskii-muzei-istorii-i-narodnoi-kultury"",""serviceName"":""Культура.рф""},{""url"":""https://map.funtam.ru/offer/poi?showMainEvent=false&shareId=d9eb5f12-dcd2-4b61-a367-7f6fd800c5bb&shareType=venue"",""serviceName"":""ФанТам""}]",15163,8276,1751,132303,"2015-09-16T13:15:36Z","2022-08-03T10:27:01Z",
Усть-Кубинский районный краеведческий музей,Усть-Кубинский район,Europe/Moscow,"ул Яковлева,д 8",,"обл Вологодская,р-н Усть-Кубинский,с Устье,ул Яковлева,д 8","{""type"":""Point""}","<p><span>Муниципальное учреждение культуры ""Усть-Кубинский районный краеведческий музей"" открыт 8 июля 1995 года. Основную экспозицию составили экспонаты, собранные на территории Усть-Кубинского района в 1986 году экспедицией под руководством А. А. Рыбакова. На 1 января 2025 года м</span><span>узейный фонд составляет более 4 тысяч единиц хранения. </span></p><p><span>Для посетителей открыты один выставочный и два экспозиционных зала. Основная экспозиция музея посвящена истории края, духовно-культурному наследию, развитию ремесел, промыслов и производств. </span></p><p><span>Для посетителей музея проводятся обзорные экскурсии, музейные уроки, лекции, конференции, тематические мероприятия, вечера-встречи, праздники.</span></p>",,ustkub.muzey@gmail.com,"[{""value"":""78175321659"",""comment"":""""}]","{""url"":""https://all.culture.ru/uploads/56ed0de6a18d6816eb676b9fc80819fe.jpeg"",""title"":""91670.660x371.jpg""}",,,Музеи и галереи,МУК «Усть-Кубинский районный краеведческий музей»,Усть-Кубинский район,Europe/Moscow,"ул Яковлева,д 8",,"обл Вологодская,р-н Усть-Кубинский,с Устье,ул Яковлева,д 8",,3519003344,mincult,Усть-Кубинский район,Europe/Moscow,,10105,"[{""name"":""Доступная среда""}]",,"{""from"":""09:00:00"",""to"":""17:15:00""}","{""from"":""09:00:00"",""to"":""17:15:00""}","{""from"":""09:00:00"",""to"":""17:15:00""}","{""from"":""09:00:00"",""to"":""17:15:00""}","{""from"":""09:00:00"",""to"":""17:00:00""}",,,,,,,,"[""Краеведческий""]",,15165,"[{""url"":""https://afisha7.ru/uste/muzei-i-galerei/7241pl"",""serviceName"":""Афиша7""},{""url"":""https://www.culture.ru/institutes/12313/ust-kubinskii-raionnyi-kraevedcheskii-muzei"",""serviceName"":""Культура.рф""},{""url"":""https://map.funtam.ru/offer/poi?showMainEvent=false&shareId=a039ccf1-529a-4d74-b095-c5b9b8fe4f9a&shareType=venue"",""serviceName"":""ФанТам""}]",15165,12313,1760,141923,"2015-09-16T13:19:29Z","2025-10-31T12:45:22Z",
Музей-квартира Василия Ивановича Белова,Вологда,Europe/Moscow,"ул Октябрьская,д 10","подъезд 1, кв. 4","обл Вологодская,г Вологда,ул Октябрьская,д 10","{""type"":""Point""}","<p>Мемориальный музей-квартира Василия Белова – единственный в мире мемориальный музей, посвященный Василию Ивановичу Белову (1932–2012), русскому писателю, одному из крупнейших представителей деревенской прозы.</p><p>Музей предоставляет своим посетителям возможность окунуться в атмосферу второй половины ХХ и начала XXI века, познакомиться с биографией и творчеством русского писателя, чье творчество вошло в сокровищницу современной отечественной литературы. Музей был открыт 21 октября 2015 года в доме, в котором Василий Иванович Белов жил с семьей начиная с 1987 года. Мероприятие состоялось в рамках Года литературы в России и было приурочено ко дню рождения Василия Ивановича Белова. </p><p>В мемориальной квартире посетители увидят подлинные вещи писателя и его семьи. В экспозиции представлено около 1 500 предметов. Обстановка музея, его дух помогают лучше понять и оценить произведения, созданные великим мастером. Неизменной осталась обстановка кабинета Василия Ивановича, его письменный стол, личная библиотека, которая насчитывает более 4 000 томов. Василий Белов очень любил живопись, что отражается в уникальной коллекции изобразительного искусства, включающей и работы самого писателя. Интерес для посетителей представляют комнаты супруги Ольги Сергеевны Беловой и дочери писателя Анны. Многие экспонаты в музее – подарки Василию Белову от многочисленных почитателей его таланта. </p><p>Квартира в годы жизни Василия Ивановича была тем центром, который объединял общественную, культурную, художественную жизнь города: сюда приходили писатели, художники, композиторы, политики, священнослужители; здесь велись многочасовые разговоры о жизни, о литературе, о судьбах страны; здесь бывали Распутин, Крупин, Личутин, Лихоносов, пел романсы Штоколов, выступал Савва Ямщиков и многие другие крупнейшие представители культурной жизни не только Вологодчины, но и всей России. </p><p>У каждого предмета в этой квартире своя история, своя связь с прошлым, с тем временем, когда здесь жил и работал Василий Белов. Здесь им были написаны романы «Год великого перелома», «Час шестый», повести «Бухтины вологодские» и «Повесть об одной деревне», автобиографическая повесть «Невозвратные годы», воспоминания о Василии Шукшине «Тяжесть креста», о Валерии Гаврилине «Голос, рожденный под Вологдой»; многочисленные рассказы, в том числе ставший визитной карточкой писателя «Душа бессмертна»; очерки, публицистические статьи, стихи.</p>",https://kirmuseum.org/ru/muzeynie_kompleksi/muzey_kvartira_v_i_belova,belovmuseum@yandex.ru,"[{""value"":""79211261423"",""comment"":""директор""},{""value"":""79211420856"",""comment"":""сотрудники""}]","{""url"":""https://all.culture.ru/uploads/d7bee9d4b59373acec4ded077417a280.jpg"",""title"":""_DSC4384.jpg""}","[{""url"":""https://all.culture.ru/uploads/8a6be59e9e50cbe7e21809c7796fc799.jpg"",""title"":""_DSC4367.jpg""},{""url"":""https://all.culture.ru/uploads/39a57f81df7fd4cd04bbbd155e6a7caf.jpg"",""title"":""_DSC4395.jpg""},{""url"":""https://all.culture.ru/uploads/0016361c9019a7dbeb7ca097d86e068f.jpg"",""title"":""_DSC4451.jpg""},{""url"":""https://all.culture.ru/uploads/98907f438a4866c7f32decd1280a4bce.jpg"",""title"":""DSC_1451.jpg""}]",,Музеи и галереи,ФГБУК «Кирилло-Белозерский историко-архитектурный и художественный музей-заповедник»,Кирилловский район,Europe/Moscow,"Заповедная зона, Соборная пл., 1  ",,"обл Вологодская,р-н Кирилловский,г Кириллов,Заповедная зона, Соборная пл., 1  ",,3511001352,mincult,РФ,Europe/Moscow,"[{""network"":""vk"",""name"":""Кирилло-Белозерский музей-заповедник"",""networkId"":""2200394"",""updateDate"":""2015-05-22T11:30:08Z"",""createDate"":""2015-05-22T11:30:08Z"",""accountId"":1010,""postingGroupId"":1397},{""network"":""twitter"",""name"":""Kirillov's museum"",""networkId"":""231729577"",""isPersonal"":true,""updateDate"":""2015-05-22T11:30:25Z"",""createDate"":""2015-05-22T11:30:25Z"",""accountId"":1271,""postingGroupId"":1398},{""network"":""ok"",""name"":""Кирилло-Белозерский музей-заповедник"",""networkId"":""52208700358722"",""updateDate"":""2015-05-22T11:30:35Z"",""createDate"":""2015-05-22T11:30:35Z"",""accountId"":1272,""postingGroupId"":1399}]",613,"[{""name"":""Музей-квартира""}]",,"{""from"":""10:00:00"",""to"":""18:00:00""}","{""from"":""10:00:00"",""to"":""18:00:00""}","{""from"":""10:00:00"",""to"":""18:00:00""}","{""from"":""10:00:00"",""to"":""18:00:00""}","{""from"":""10:00:00"",""to"":""18:00:00""}","{""from"":""10:00:00"",""to"":""18:00:00""}","{""from"":""10:00:00"",""to"":""18:00:00""}",,,,,https://kirmuseum.org/belovtour/index.html?scene_name=scene_pano-5139,"[""Литературный"",""Персональный, мемориальный""]",,15227,"[{""url"":""https://www.culture.ru/institutes/20860/muzei-kvartira-vasiliya-ivanovicha-belova"",""serviceName"":""Культура.рф""},{""url"":""https://afisha7.ru/vologda/muzei-i-galerei/7289pl"",""serviceName"":""Афиша7""},{""url"":""https://map.funtam.ru/offer/poi?showMainEvent=false&shareId=2912cf57-d989-4b7c-b364-83e4ca22b826&shareType=venue"",""serviceName"":""ФанТам""}]",15227,20860,,,"2015-09-21T09:20:40Z","2025-09-02T13:53:41Z",
